{"session_id": "142e9493-8bf8-4124-b8a8-9b2d9dfcb9fc", "chunk_seq": 8, "t0_ms": 60010.0, "source": "udp", "emg_env": {"device_id": "CHETNA_BIO_001", "rate_hz": 100, "unit": "raw_adc", "t_ms": [60010.0, 60020.0, 60030.0, 60040.0, 60050.0, 60060.0, 60070.0, 60080.0, 60090.0, 60100.0, 60104.0, 60114.0, 60124.0, 60134.0, 60144.0, 60154.0, 60164.0, 60174.0, 60184.0, 60194.0, 60213.0, 60223.0, 60233.0, 60243.0, 60253.0, 60263.0, 60273.0, 60283.0, 60293.0, 60303.0, 60307.0, 60317.0, 60327.0, 60337.0, 60347.0, 60357.0, 60367.0, 60377.0, 60387.0, 60397.0, 60401.0, 60411.0, 60421.0, 60431.0, 60441.0, 60451.0, 60461.0, 60471.0, 60481.0, 60491.0, 60510.0, 60520.0, 60530.0, 60540.0, 60550.0, 60560.0, 60570.0, 60580.0, 60590.0, 60600.0, 60604.0, 60614.0, 60624.0, 60634.0, 60644.0, 60654.0, 60664.0, 60674.0, 60684.0, 60694.0, 60713.0, 60723.0, 60733.0, 60743.0, 60753.0, 60763.0, 60773.0, 60783.0, 60793.0, 60803.0, 60807.0, 60817.0, 60827.0, 60837.0, 60847.0, 60857.0, 60867.0, 60877.0, 60887.0, 60897.0, 60901.0, 60911.0, 60921.0, 60931.0, 60941.0, 60951.0, 60961.0, 60971.0, 60981.0, 60991.0, 61010.0, 61020.0, 61030.0, 61040.0, 61050.0, 61060.0, 61070.0, 61080.0, 61090.0, 61100.0, 61104.0, 61114.0, 61124.0, 61134.0, 61144.0, 61154.0, 61164.0, 61174.0, 61184.0, 61194.0, 61213.0, 61223.0, 61233.0, 61243.0, 61253.0, 61263.0, 61273.0, 61283.0, 61293.0, 61303.0, 61307.0, 61317.0, 61327.0, 61337.0, 61347.0, 61357.0, 61367.0, 61377.0, 61387.0, 61397.0, 61401.0, 61411.0, 61421.0, 61431.0, 61441.0, 61451.0, 61461.0, 61471.0, 61481.0, 61491.0, 61510.0, 61520.0, 61530.0, 61540.0, 61550.0, 61560.0, 61570.0, 61580.0, 61590.0, 61600.0, 61604.0, 61614.0, 61624.0, 61634.0, 61644.0, 61654.0, 61664.0, 61674.0, 61684.0, 61694.0, 61713.0, 61723.0, 61733.0, 61743.0, 61753.0, 61763.0, 61773.0, 61783.0, 61793.0, 61803.0, 61807.0, 61817.0, 61827.0, 61837.0, 61847.0, 61857.0, 61867.0, 61877.0, 61887.0, 61897.0, 61901.0, 61911.0, 61921.0, 61931.0, 61941.0, 61951.0, 61961.0, 61971.0, 61981.0, 61991.0, 62010.0, 62020.0, 62030.0, 62040.0, 62050.0, 62060.0, 62070.0, 62080.0, 62090.0, 62100.0, 62104.0, 62114.0, 62124.0, 62134.0, 62144.0, 62154.0, 62164.0, 62174.0, 62184.0, 62194.0, 62213.0, 62223.0, 62233.0, 62243.0, 62253.0, 62263.0, 62273.0, 62283.0, 62293.0, 62303.0, 62307.0, 62317.0, 62327.0, 62337.0, 62347.0, 62357.0, 62367.0, 62377.0, 62387.0, 62397.0, 62401.0, 62411.0, 62421.0, 62431.0, 62441.0, 62451.0, 62461.0, 62471.0, 62481.0, 62491.0, 62510.0, 62520.0, 62530.0, 62540.0, 62550.0, 62560.0, 62570.0, 62580.0, 62590.0, 62600.0, 62604.0, 62614.0, 62624.0, 62634.0, 62644.0, 62654.0, 62664.0, 62674.0, 62684.0, 62694.0, 62713.0, 62723.0, 62733.0, 62743.0, 62753.0, 62763.0, 62773.0, 62783.0, 62793.0, 62803.0, 62807.0, 62817.0, 62827.0, 62837.0, 62847.0, 62857.0, 62867.0, 62877.0, 62887.0, 62897.0, 62901.0, 62911.0, 62921.0, 62931.0, 62941.0, 62951.0, 62961.0, 62971.0, 62981.0, 62991.0, 63010.0, 63020.0, 63030.0, 63040.0, 63050.0, 63060.0, 63070.0, 63080.0, 63090.0, 63100.0, 63104.0, 63114.0, 63124.0, 63134.0, 63144.0, 63154.0, 63164.0, 63174.0, 63184.0, 63194.0, 63213.0, 63223.0, 63233.0, 63243.0, 63253.0, 63263.0, 63273.0, 63283.0, 63293.0, 63303.0, 63307.0, 63317.0, 63327.0, 63337.0, 63347.0, 63357.0, 63367.0, 63377.0, 63387.0, 63397.0, 63401.0, 63411.0, 63421.0, 63431.0, 63441.0, 63451.0, 63461.0, 63471.0, 63481.0, 63491.0, 63510.0, 63520.0, 63530.0, 63540.0, 63550.0, 63560.0, 63570.0, 63580.0, 63590.0, 63600.0, 63604.0, 63614.0, 63624.0, 63634.0, 63644.0, 63654.0, 63664.0, 63674.0, 63684.0, 63694.0, 63713.0, 63723.0, 63733.0, 63743.0, 63753.0, 63763.0, 63773.0, 63783.0, 63793.0, 63803.0, 63807.0, 63817.0, 63827.0, 63837.0, 63847.0, 63857.0, 63867.0, 63877.0, 63887.0, 63897.0, 63901.0, 63911.0, 63921.0, 63931.0, 63941.0, 63951.0, 63961.0, 63971.0, 63981.0, 63991.0, 64010.0, 64020.0, 64030.0, 64040.0, 64050.0, 64060.0, 64070.0, 64080.0, 64090.0, 64100.0, 64104.0, 64114.0, 64124.0, 64134.0, 64144.0, 64154.0, 64164.0, 64174.0, 64184.0, 64194.0, 64213.0, 64223.0, 64233.0, 64243.0, 64253.0, 64263.0, 64273.0, 64283.0, 64293.0, 64303.0, 64307.0, 64317.0, 64327.0, 64337.0, 64347.0, 64357.0, 64367.0, 64377.0, 64387.0, 64397.0, 64401.0, 64411.0, 64421.0, 64431.0, 64441.0, 64451.0, 64461.0, 64471.0, 64481.0, 64491.0, 64510.0, 64520.0, 64530.0, 64540.0, 64550.0, 64560.0, 64570.0, 64580.0, 64590.0, 64600.0, 64604.0, 64614.0, 64624.0, 64634.0, 64644.0, 64654.0, 64664.0, 64674.0, 64684.0, 64694.0, 64713.0, 64723.0, 64733.0, 64743.0, 64753.0, 64763.0, 64773.0, 64783.0, 64793.0, 64803.0, 64807.0, 64817.0, 64827.0, 64837.0, 64847.0, 64857.0, 64867.0, 64877.0, 64887.0, 64897.0, 64901.0, 64911.0, 64921.0, 64931.0, 64941.0, 64951.0, 64961.0, 64971.0, 64981.0, 64991.0], "value": [422.3, 414.3, 430.8, 418.6, 425.2, 415.2, 415.7, 420.6, 416.9, 415.3, 419.8, 429.5, 423.7, 426.5, 411.9, 419.4, 420.3, 418.7, 418.1, 409.5, 410.2, 422.5, 416.6, 421.9, 417.2, 410.3, 417.8, 421.4, 416.8, 420.7, 420.5, 417.1, 424.0, 423.2, 422.4, 417.4, 412.4, 420.7, 427.0, 424.7, 423.8, 412.5, 413.3, 423.9, 416.9, 418.0, 411.7, 417.7, 422.6, 421.8, 426.6, 420.7, 414.0, 423.6, 425.1, 427.1, 422.2, 409.9, 421.0, 413.2, 428.5, 430.7, 428.2, 433.6, 413.2, 414.2, 415.7, 414.5, 423.5, 413.9, 405.2, 410.4, 423.9, 418.3, 417.8, 413.4, 418.3, 414.2, 418.5, 412.8, 431.9, 421.6, 431.7, 411.3, 423.8, 419.0, 413.5, 419.2, 423.2, 422.2, 418.8, 420.3, 413.5, 421.1, 409.5, 430.5, 425.1, 409.3, 425.6, 420.0, 428.1, 429.1, 424.8, 407.9, 417.2, 422.3, 424.0, 420.2, 431.6, 420.4, 424.3, 417.6, 412.7, 419.3, 419.8, 410.5, 422.5, 434.9, 427.5, 418.6, 415.3, 424.6, 422.1, 422.0, 420.0, 417.0, 428.9, 413.8, 428.2, 398.4, 426.8, 421.7, 429.1, 425.7, 423.8, 416.6, 423.5, 422.1, 418.7, 433.9, 415.9, 421.9, 426.0, 420.9, 422.0, 427.4, 430.1, 424.1, 422.2, 418.7, 420.9, 414.9, 415.6, 423.7, 423.0, 410.6, 421.6, 421.8, 428.9, 419.1, 432.0, 422.4, 425.2, 425.1, 414.8, 425.7, 430.5, 426.9, 428.1, 415.9, 419.2, 417.0, 423.7, 415.5, 429.2, 423.3, 416.0, 411.5, 415.6, 428.3, 417.5, 415.4, 418.2, 422.1, 421.0, 428.3, 425.5, 421.2, 422.2, 415.2, 409.0, 414.2, 414.7, 420.8, 425.6, 417.3, 433.0, 420.6, 416.6, 423.9, 423.4, 409.7, 429.8, 416.8, 423.5, 420.1, 424.4, 410.7, 416.2, 424.2, 424.9, 412.0, 412.4, 425.6, 429.9, 424.9, 417.5, 413.5, 419.3, 412.9, 416.5, 419.8, 420.8, 418.9, 422.1, 418.8, 419.1, 418.3, 419.2, 416.0, 427.6, 418.9, 414.2, 420.5, 425.0, 418.0, 419.4, 408.1, 417.0, 421.6, 422.2, 421.3, 418.2, 424.6, 416.8, 419.4, 424.1, 434.6, 434.2, 435.3, 411.2, 417.0, 421.0, 435.9, 428.9, 425.2, 416.8, 419.0, 417.6, 422.5, 424.5, 432.3, 422.2, 423.2, 418.3, 420.2, 429.7, 412.8, 420.9, 421.0, 429.6, 417.5, 426.4, 414.4, 423.8, 418.3, 425.6, 407.0, 414.2, 402.8, 416.8, 420.4, 424.1, 411.6, 414.4, 422.7, 409.0, 416.7, 422.9, 422.5, 424.9, 423.9, 419.7, 413.8, 426.8, 411.0, 424.9, 411.7, 413.6, 417.5, 436.6, 415.0, 422.9, 429.3, 409.4, 429.2, 421.6, 419.5, 411.6, 420.0, 423.5, 421.9, 413.6, 424.5, 409.8, 422.9, 419.7, 423.3, 419.5, 420.7, 410.3, 430.8, 420.9, 419.1, 414.1, 422.4, 436.0, 419.5, 417.8, 411.3, 417.6, 415.0, 412.5, 428.8, 416.6, 417.7, 412.2, 422.2, 414.8, 414.6, 418.0, 420.2, 413.1, 409.6, 417.0, 433.1, 433.6, 419.8, 415.5, 420.0, 425.7, 411.2, 425.6, 419.3, 423.8, 418.3, 418.1, 413.3, 417.4, 425.1, 416.8, 427.3, 419.2, 421.8, 421.3, 410.9, 429.5, 411.8, 418.9, 427.2, 423.0, 423.5, 426.5, 416.9, 419.9, 411.7, 415.8, 417.3, 423.8, 415.8, 419.7, 425.7, 428.8, 419.1, 419.8, 424.1, 425.2, 409.6, 410.2, 415.4, 419.8, 429.7, 422.1, 415.9, 414.1, 424.9, 428.8, 410.4, 431.3, 422.8, 416.9, 413.1, 421.9, 422.5, 415.1, 414.2, 428.4, 428.3, 420.5, 416.7, 423.2, 416.6, 426.9, 419.8, 425.2, 411.3, 424.6, 427.0, 423.5, 423.9, 433.9, 415.0, 422.6, 428.2, 423.6, 418.4, 423.0, 410.0, 414.8, 427.3, 427.5, 417.6, 424.6, 408.5, 408.9, 421.5, 419.2, 420.7, 415.4, 424.2, 415.5, 416.0, 433.2, 423.0, 422.0, 422.5, 423.0, 419.2, 427.7, 411.8, 431.4, 422.8, 422.9, 410.9, 419.5, 420.2, 416.4, 416.6, 415.2, 414.0, 416.5, 413.5, 423.6, 431.1, 419.2, 417.4, 430.3, 413.7, 422.6, 415.2, 414.7, 422.4, 410.8, 421.1, 412.0, 408.5, 408.1, 419.6, 421.7, 413.4, 411.0, 418.9, 407.5, 422.7, 414.8, 423.0, 424.5, 404.2, 421.5, 422.8, 422.4, 417.8, 429.7, 419.7, 422.4, 410.0, 414.6, 426.8, 412.8, 411.6]}}