{"session_id": "b041941e-79da-4df7-b42d-aff7cd519c54", "chunk_seq": 14, "t0_ms": 106410.0, "source": "udp", "emg_env": {"device_id": "CHETNA_BIO_001", "rate_hz": 100, "unit": "raw_adc", "t_ms": [106410.0, 106420.0, 106430.0, 106440.0, 106450.0, 106460.0, 106470.0, 106480.0, 106490.0, 106500.0, 106504.0, 106514.0, 106524.0, 106534.0, 106544.0, 106554.0, 106564.0, 106574.0, 106584.0, 106594.0], "value": [421.9, 425.2, 422.3, 419.3, 424.6, 413.6, 420.5, 415.5, 420.8, 414.7, 422.2, 418.8, 413.1, 422.4, 419.2, 421.2, 425.4, 419.6, 416.2, 413.2]}, "imu": {"device_id": "SLEEVE_001", "rate_hz": 100, "t_ms": [106500.0, 106500.0, 106515.0, 106531.0, 106531.0, 106547.0, 106562.0, 106562.0, 106578.0, 106594.0, 106594.0, 106609.0, 106625.0, 106625.0, 106640.0, 106640.0, 106656.0, 106672.0, 106672.0, 106687.0], "ax": [0.0183, 0.0039, -0.0341, -0.0361, 0.0416, -0.0008, 0.0206, 0.0251, 0.0603, 0.0124, -0.0061, -0.0229, 0.0506, -0.0164, -0.0226, 0.0017, 0.0623, -0.0101, 0.0631, 0.0064], "ay": [-0.0212, 0.0036, -0.0338, 0.0467, 0.0391, -0.0332, 0.0315, -0.0108, 0.0124, 0.0628, -0.0021, 0.0248, 0.0455, 0.0473, -0.1303, -0.0429, 0.1299, -0.0229, -0.0737, 0.0144], "az": [9.8446, 9.797, 9.8627, 9.7375, 9.8085, 9.914, 9.7083, 9.8551, 9.7776, 9.8821, 9.7765, 9.7618, 9.7279, 9.7757, 9.7869, 9.7911, 9.8433, 9.8308, 9.8107, 9.8478], "gx": [-0.0106, 0.018, 0.0045, -0.0135, -0.0034, 0.0116, 0.0092, -0.0101, -0.0078, -0.003, 0.0133, -0.0166, -0.0039, 0.0118, -0.0146, 0.0171, -0.0099, 0.0026, -0.0055, 0.0066], "gy": [0.0005, 0.0012, -0.0072, -0.0012, -0.0063, -0.0073, -0.0188, 0.0079, -0.0149, -0.0046, 0.013, 0.0131, 0.0122, -0.0044, -0.0072, -0.0004, -0.0156, -0.002, -0.0073, -0.001], "gz": [0.0007, -0.0064, 0.0012, -0.0021, -0.0107, -0.011, 0.0073, -0.0113, -0.0032, -0.0006, 0.0058, -0.0161, 0.0011, -0.0088, 0.0126, 0.022, 0.0006, -0.0184, 0.0105, -0.0137]}}