{
  "session_id": "7a1b9c52-3d0e-4f2a-9b66-5d1c0a3e8f10",
  "chunk_seq": 0,
  "t0_ms": 0,
  "source": "synthetic",
  "emg_env": {
    "device_id": "CHETNA_BIO_001",
    "rate_hz": 100,
    "unit": "raw_adc",
    "t_ms": [
      0,
      10,
      20,
      30,
      40,
      50,
      60,
      70,
      80,
      90,
      100,
      110,
      120,
      130,
      140,
      150,
      160,
      170,
      180,
      190
    ],
    "value": [
      411.0,
      413.1,
      416.9,
      416.9,
      419.4,
      419.1,
      417.4,
      417.3,
      413.8,
      412.4,
      408.7,
      406.3,
      405.2,
      405.0,
      402.4,
      403.0,
      405.4,
      408.2,
      409.5,
      411.6
    ]
  },
  "imu": {
    "device_id": "SLEEVE_001",
    "rate_hz": 100,
    "t_ms": [
      0,
      10,
      20,
      30,
      40,
      50,
      60,
      70,
      80,
      90,
      100,
      110,
      120,
      130,
      140,
      150,
      160,
      170,
      180,
      190
    ],
    "ax": [
      0.12,
      0.101,
      0.117,
      0.106,
      0.103,
      0.102,
      0.106,
      0.116,
      0.104,
      0.112,
      0.113,
      0.107,
      0.111,
      0.101,
      0.101,
      0.104,
      0.114,
      0.109,
      0.106,
      0.112
    ],
    "ay": [
      9.789,
      9.786,
      9.796,
      9.794,
      9.785,
      9.791,
      9.791,
      9.798,
      9.795,
      9.786,
      9.8,
      9.782,
      9.788,
      9.795,
      9.783,
      9.79,
      9.781,
      9.793,
      9.795,
      9.791
    ],
    "az": [
      0.318,
      0.306,
      0.314,
      0.312,
      0.312,
      0.309,
      0.317,
      0.319,
      0.309,
      0.313,
      0.301,
      0.314,
      0.313,
      0.32,
      0.316,
      0.306,
      0.308,
      0.313,
      0.3,
      0.309
    ],
    "gx": [
      0.001,
      0.001,
      0.001,
      0.001,
      0.001,
      0.001,
      0.001,
      0.001,
      0.001,
      0.001,
      0.001,
      0.001,
      0.001,
      0.001,
      0.001,
      0.001,
      0.001,
      0.001,
      0.001,
      0.001
    ],
    "gy": [
      -0.002,
      -0.002,
      -0.002,
      -0.002,
      -0.002,
      -0.002,
      -0.002,
      -0.002,
      -0.002,
      -0.002,
      -0.002,
      -0.002,
      -0.002,
      -0.002,
      -0.002,
      -0.002,
      -0.002,
      -0.002,
      -0.002,
      -0.002
    ],
    "gz": [
      0.0,
      0.0,
      0.0,
      0.0,
      0.0,
      0.0,
      0.0,
      0.0,
      0.0,
      0.0,
      0.0,
      0.0,
      0.0,
      0.0,
      0.0,
      0.0,
      0.0,
      0.0,
      0.0,
      0.0
    ]
  }
}
