{"session_id": "9d580915-3583-4b42-9191-82f5c5309237", "chunk_seq": 0, "t0_ms": 16.0, "source": "udp", "imu": {"device_id": "SLEEVE_001", "rate_hz": 100, "t_ms": [16.0, 16.0, 32.0, 47.0, 47.0, 63.0, 79.0, 79.0, 94.0, 94.0, 4210.0, 4225.0, 4225.0, 4241.0, 4257.0, 4257.0, 4272.0, 4288.0, 4288.0, 4304.0, 4304.0, 4319.0, 4335.0, 4335.0, 4350.0, 4366.0, 4366.0, 4382.0, 4397.0, 4397.0, 4413.0, 4429.0, 4429.0, 4444.0, 4444.0, 4460.0, 4475.0, 4475.0, 4491.0, 4507.0, 4507.0, 4522.0, 4538.0, 4538.0, 4554.0, 4554.0, 4569.0, 4585.0, 4585.0, 4600.0, 4616.0, 4616.0, 4632.0, 4647.0, 4647.0, 4663.0, 4679.0, 4679.0, 4694.0, 4694.0, 4710.0, 4725.0, 4725.0, 4741.0, 4757.0, 4757.0, 4772.0, 4788.0, 4788.0, 4804.0, 4804.0, 4819.0, 4835.0, 4835.0, 4850.0, 4866.0, 4866.0, 4882.0, 4897.0, 4897.0, 4913.0, 4929.0, 4929.0, 4944.0, 4944.0, 4960.0, 4975.0, 4975.0, 4991.0], "ax": [0.0467, -0.0296, -0.1042, 0.1173, 0.0599, -0.0097, -0.0473, -0.0881, 0.076, -0.0342, 0.1177, -0.0147, -0.0866, -0.0328, 0.0061, 0.0812, 0.0757, 0.039, 0.0526, -0.0389, -0.0207, 0.0385, -0.0701, 0.0364, 0.0588, 0.0958, -0.0368, 0.0306, -0.0561, -0.0162, 0.0889, -0.0271, 0.0345, 0.0639, -0.0831, 0.053, -0.0546, 0.0066, -0.0214, -0.0129, -0.0137, 0.0682, 0.0586, -0.0027, -0.0381, 0.0752, 0.0213, 0.025, 0.0658, 0.0307, 0.0117, -0.0214, -0.0755, 0.0191, 0.0216, -0.001, 0.0848, -0.0082, 0.0643, -0.0617, 0.0083, 0.0142, 0.0327, 0.0354, 0.0057, 0.0188, -0.0605, 0.0363, -0.0647, -0.0598, 0.0038, 0.0484, 0.0088, 0.1, -0.119, 0.023, -0.0241, 0.0095, 0.0568, 0.0023, -0.0344, -0.0152, 0.0991, -0.0048, 0.0519, 0.018, -0.1034, -0.0384, -0.0305], "ay": [0.0417, 0.0256, -0.0682, 0.0643, -0.0122, 0.032, -0.0188, -0.0199, 0.0371, -0.0163, -0.0627, -0.0436, -0.0326, 0.1041, 0.0286, 0.0235, -0.0591, -0.0081, 0.0284, -0.0012, -0.0563, 0.0187, -0.0133, 0.1098, -0.0334, -0.0377, -0.0421, 0.026, -0.0059, 0.0669, -0.0241, 0.0047, 0.0422, 0.033, -0.0089, -0.0104, 0.0214, -0.0255, -0.0042, -0.0062, -0.0676, 0.0366, 0.0249, -0.1055, -0.0231, 0.0386, -0.0291, 0.0239, 0.0407, -0.0496, -0.0554, 0.0397, -0.1504, 0.0295, 0.0738, 0.0016, -0.0437, -0.0395, 0.0742, -0.0153, 0.051, -0.0472, 0.0061, 0.0412, -0.0334, 0.1232, 0.0458, 0.0312, 0.0205, 0.0765, -0.0741, 0.1069, 0.0557, -0.0075, -0.0827, -0.0334, -0.0326, -0.0243, -0.0399, 0.0071, 0.0487, 0.0263, 0.0224, -0.0733, 0.0506, 0.0324, -0.098, -0.1012, -0.0149], "az": [9.77, 9.7675, 9.9069, 9.7963, 9.7822, 9.8885, 9.8097, 9.885, 9.7593, 9.8309, 9.7343, 9.9024, 9.8167, 9.8356, 9.8006, 9.8704, 9.7608, 9.8503, 9.7503, 9.7941, 9.7162, 9.7572, 9.7462, 9.777, 9.7906, 9.8366, 9.8616, 9.755, 9.7366, 9.7831, 9.7469, 9.783, 9.7789, 9.889, 9.7754, 9.6759, 9.8225, 9.833, 9.7828, 9.8545, 9.7972, 9.7776, 9.9145, 9.8178, 9.7504, 9.8135, 9.8701, 9.8756, 9.7379, 9.7834, 9.8922, 9.8107, 9.805, 9.7332, 9.791, 9.7402, 9.7154, 9.7922, 9.8396, 9.8393, 9.8807, 9.9089, 9.8015, 9.7864, 9.8169, 9.8402, 9.8062, 9.7948, 9.7775, 9.8264, 9.8388, 9.8219, 9.7242, 9.8413, 9.8501, 9.8262, 9.7532, 9.7867, 9.783, 9.8032, 9.8388, 9.7611, 9.8776, 9.7256, 9.7991, 9.8563, 9.8187, 9.7723, 9.8475], "gx": [-0.0056, 0.0114, 0.0112, -0.0007, 0.0062, 0.0028, 0.0162, 0.0267, -0.0071, -0.0025, -0.0143, 0.0008, 0.0094, 0.0125, -0.0079, 0.0028, 0.0321, -0.0055, -0.007, 0.0117, -0.0009, -0.019, 0.015, -0.0067, -0.0074, -0.0155, 0.0101, -0.0076, -0.0045, 0.002, -0.0115, 0.0009, -0.0026, 0.0066, 0.0053, 0.0016, -0.0025, 0.0018, -0.0108, -0.0117, -0.0182, 0.0112, -0.003, -0.0023, -0.0018, 0.0009, 0.0051, -0.0132, 0.0105, 0.0126, 0.0183, 0.0071, 0.0032, 0.0029, 0.0093, 0.0075, 0.0037, -0.0039, -0.0036, 0.0082, 0.0094, -0.0158, -0.0104, -0.0015, -0.0129, 0.0093, 0.0021, 0.0111, -0.0111, 0.0008, -0.0061, -0.0077, -0.0089, -0.0169, -0.0052, -0.0057, 0.0043, -0.0098, 0.0067, 0.0199, -0.0133, 0.0019, -0.0069, 0.0065, 0.0237, 0.0016, 0.0049, -0.0, -0.0092], "gy": [-0.0154, -0.0095, 0.0036, 0.0024, -0.0112, 0.009, -0.0105, 0.0059, 0.0209, 0.0064, 0.0035, 0.0048, -0.0024, 0.0114, -0.0053, 0.0208, -0.0048, 0.0046, 0.0065, -0.0084, -0.0147, -0.0059, -0.0249, -0.0062, -0.0118, -0.0004, -0.0127, 0.0119, -0.0005, 0.0005, -0.0076, -0.0159, 0.0012, 0.0064, 0.0049, 0.0155, -0.003, 0.0014, -0.0069, 0.0128, 0.0003, -0.0113, 0.0021, -0.0197, -0.0015, 0.0111, -0.007, -0.0229, 0.0146, -0.0166, -0.0028, -0.0041, -0.009, -0.0109, 0.0015, 0.008, 0.0015, 0.0001, 0.0138, -0.0067, 0.0061, 0.0025, 0.005, -0.004, -0.0302, 0.0132, -0.0065, -0.0057, 0.0081, -0.0026, 0.0026, -0.0117, -0.0108, 0.0074, -0.0119, 0.0116, 0.0097, -0.0042, 0.0035, -0.0077, 0.0138, -0.0043, 0.0108, 0.0196, -0.0026, 0.009, 0.0121, 0.0054, 0.0052], "gz": [0.0245, 0.0025, 0.0025, -0.0048, 0.0056, -0.0106, 0.0086, -0.0125, 0.0085, 0.0141, 0.0138, -0.0034, -0.0091, -0.0013, 0.0129, -0.0027, -0.0104, 0.0027, 0.0178, -0.0048, 0.0051, -0.0046, 0.0023, -0.0013, -0.0025, 0.0116, 0.0202, -0.0028, -0.0026, 0.0006, -0.0139, -0.0125, -0.007, -0.0025, -0.0112, -0.0052, -0.008, 0.0139, 0.0142, 0.003, 0.0012, -0.0015, 0.0075, -0.009, -0.0028, -0.0113, 0.0033, 0.0006, 0.0004, -0.0029, 0.0203, -0.0097, -0.0126, -0.0099, -0.0027, -0.0184, 0.0077, 0.0026, 0.002, -0.0009, 0.0027, 0.0024, 0.0287, -0.0093, -0.0244, -0.0014, -0.0142, -0.0129, 0.0096, 0.0183, -0.0127, -0.003, 0.0041, 0.0024, 0.0008, -0.0122, 0.008, -0.0001, 0.0128, 0.0026, 0.0077, 0.0004, -0.0192, -0.0004, 0.0072, 0.0073, -0.0058, 0.0184, -0.0099]}}