{
  "session_id": "7a1b9c52-3d0e-4f2a-9b66-5d1c0a3e8f10",
  "chunk_seq": 0,
  "t0_ms": 0,
  "source": "synthetic",
  "emg_env": {
    "device_id": "CHETNA_BIO_001",
    "rate_hz": 100,
    "unit": "raw_adc",
    "t_ms": [
      0,
      10,
      20,
      30,
      40,
      50,
      60,
      70,
      80,
      90,
      100,
      110,
      120,
      130,
      140,
      150,
      160,
      170,
      180,
      190
    ],
    "value": [
      411.0,
      413.1,
      416.9,
      416.9,
      419.4,
      419.1,
      417.4,
      417.3,
      413.8,
      412.4,
      408.7,
      406.3,
      405.2,
      405.0,
      402.4,
      403.0,
      405.4,
      408.2,
      409.5,
      411.6
    ]
  }
}
